{
  "member": "did:cid:bagaaieravnv5onsflewvrz6urhwfjixfnwq7bgc3ejhlrj2nekx75ddhdupq",
  "memberOf": "did:cid:bagaaiera3qko5a3y6w4bjvr3iedqjt5flkvqi4gm2ytjip3c2ix25hezflzq",
  "membershipRole": "member",
  "status": "active",
  "effectiveFrom": "2026-02-19T00:00:00Z",
  "governanceReference": "https://example.org/dtg/governance/v1"
}
